raw_row_number,company_name_raw,stand_no,sector,products,country,website_text,website_url,company_column,details
49,Asasiat Development for Agriculture & Trade Co.,5-249,"Agriculture Technologies, Crop Farming","Greenhouses Solutions, Crop Protection, Farming Technologies, Fertilizers & Pesticides, Landscaping & Nurseries",Saudi Arabia,www.asasiatsa.com,http://www.asasiatsa.com,Asasiat Development for Agriculture & Trade Co.,"The company provides imported agricultural production inputs, such as fertilizers, pesticides, seeds, and spare parts, and has been in this field for over 30 years. It has exclusive agencies for more than 85 products from around the world for major agricultural companies. It has 10 branches serving all agricultural regions of the Kingdom."
50,Ashapura International Limited,3-174,,,India,,,,
51,"ASM Process Automation (Ali Magboul Trade Co., Ltd.)",4-389,"Agriculture Technologies, Poultry Livestock & Dairy Farming, Agro-Food Processing & Packaging","AI & Smart Applications, Poultry Systems & Technologies, Agro-Food Packaging, Agro-Food Production & Processing",Saudi Arabia,www.asm.net,http://www.asm.net,"ASM Process Automation (Ali Magboul Trade Co., Ltd.)","ASM PROCESS AUTOMATIONCertified Siemens Solution Partner – EXPERT Level (Middle East)With over 15 years of experience, ASM Process Automation is the only Siemens-certified EXPERT in the Middle East, delivering high-performance industrial automation solutions.We provide turnkey systems and specialized expertise in Feeds, Flour, Sugar, Silos, Bagging, Weighing, Dosing, and Cooling. ASM collaborates with leading international partners from France, Germany, and Italy to ensure cutting-edge, reliable, and cost-effective automation technologies.Our structured approach, strong technical skills, and fast local support have earned us a solid reputation and long-standing client satisfaction across GCC countries.ASM is committed to delivering not only innovative solutions but also outstanding after-sales service that keeps operations running smoothly. Choose ASM — where quality, efficiency, and trusted expertise come together."
52,Astra Agricultural Company Ltd.,3-139,"Crop Farming, Poultry Livestock & Dairy Farming","Crop Protection, Fertilizers & Pesticides, Feeds & Additives",Saudi Arabia,www.astrachem.net,http://www.astrachem.net,Astra Agricultural Company Ltd.,"Astra Agricultural Company is a member of Astra Industrial Group (AIG). Established in 1988 and is a well-known contributor in the horticultural and agricultural sector in KSA and other neighboring countries through its sister company Astrachem, as hundreds of farmers depend on Astra to supply their requirements of high-quality inputs from reputable resources. Products include:Fertilizers: Powder, Granular, Florabelle, Liquid and Suspension (Astrachem-KSA), Chelated Micronutrients (BASF – Germany & UK), Straight Fertilizers (Various international sources).Agrochemicals: Insecticides, Fungicides, Herbicides, Public Health and Vet. Pesticides, Additives and Adjuvants (Astrachem-KSA), FMC Corp. – USA, UPL – India and Agrostulln GmbH – Germany. Quality Hybrid Vegetable Seeds: Monsanto (DeRuiter / Seminis Seeds) – Holland, Bejo Zaden – Holland, US Agri Seeds – USA, Klein Karoo – Holland, Ergon International – Holland, East West International – Thailand, Seed Potatoes from Agrico – Holland, Peatmoss & Potting Soil from Kekkila – Finland. Veterinary Products: Cenavisa – Spain, Intas Pharmaceuticals – India, Ectoparasiticides from ASTRACHEM – KSA. In addition to many other products related to horticultural and agricultural sectors."
53,Avagro Tarim,3-192,Crop Farming,Fertilizers & Pesticides,Turkiye,www.avagro.com.tr,http://www.avagro.com.tr/,Avagro Tarim,"Avagro Agriculture Chemistry is established in 2013 at the Antalya Organized Industrial Zone on the wholesaler complex. From day one, it gives great importance to Research and Development (R&D). With its R&D Laboratory, which has been developed with expert chemists, Avagro has set the principles of transparency, honesty, mutual respect, adherence to ethical values, and sensitivity to environment and social responsibility to the basis of both its products and commercial activities."
54,Aytok Filtre Sistemleri Plastik Makina Diş Ticaret Ltd Şti,3-188,"Agriculture Technologies, Aquaculture, Crop Farming","Greenhouses Solutions, Smart Farming, Smart Irrigation, Aquaculture Systems & Technologies, Farming Technologies",Turkiye,www.aytokfiltre.com,http://www.aytokfiltre.com,Aytok Filtre Sistemleri Plastik Makina Diş Ticaret Ltd Şti,"Aytok has been delivering industry leading water filtration solutions for industrial and agricultural applications since 1997. From our cutting edge 30,000 m² facility, we manufacture plastic, automatic and media filters, advanced valves, and irrigation systems—powered by our 2.5 million kWh/year rooftop solar array. With robotic welding, state of the art automation and upcoming IoT connectivity, we’re driving a full digital transformation.Our R&D team engineers tailored systems—featuring innovations like the Flushcore® smart controller and Hydrofilt® self cleaning filters—to meet diverse field requirements. Rigorous quality control at every stage ensures reliability and a customer satisfaction rate above 90%. Serving clients in over 90 countries, Aytok is your solution partner for sustainable, efficient water management.Visit us to explore “Beyond Filtration, Beyond Limits.”"
55,Beijing Kingpeng International Hi-Tech Corporation,1-481,Agriculture Technologies,"AI & Smart Applications, Greenhouses Solutions, Hydroponics, Smart Farming, Smart Irrigation, Vertical Farming",China,www.chinakingpeng.com,http://www.chinakingpeng.com,Beijing Kingpeng International Hi-Tech Corporation,"Kingpeng, as a member enterprise of Sunlon Group, started from 1950s, Kingpeng has been involved on greenhouse business for 60 years, and is the only listed Greenhouse Company in China Stock Market. As a leading greenhouse manufacture and exporter from China, Kingpeng provides service of greenhouse design, production and installation with various functions. Domestic business covers from Nansha in the south to Mohe in the north, projects distributed in 31 provinces and autonomous regions. Its international business exports to more than 60 countries and regions and has won wide recognition from customers both domestic and abroad."
56,"Beijing Sangreen Co., Ltd.",1-382,"Agriculture Technologies, Aquaculture","Greenhouses Solutions, Hydroponics, Smart Farming, Smart Irrigation, Vertical Farming, Aquaculture Systems & Technologies",China,www.sangreenhouse.com,http://www.sangreenhouse.com,"Beijing Sangreen Co., Ltd.","SANGREEN is a professional greenhouse manufacturer and exporter from China, Sangreen provides service of greenhouse design, production and installation with various functions.Up to now, Sangreen team has the experiences of exporting greenhouse products to more than 50 countries, including Kuwait, Oman, Qatar, Saudi Arabia, and UAE in the gulf region. Now, the comprehensive services and solutions have made Sangreen become an important player in horticultural sector around the world."
57,Bene Meat Technologies A.S.,1-463,,,Czech Republic,,,,
58,Beta Fidan Tissue Culture & Breeding,5-119,"Organic & Agro-Food, Crop Farming","Spices & Oil, Farming Technologies, Landscaping & Nurseries",Turkiye,www.betafidan.com.tr,http://www.betafidan.com.tr/,Beta Fidan Tissue Culture & Breeding,"Since 1992, BETA FIDAN TISSUE CULTURE & BREEDING has been producing certified and disease-free fruit plants, including olive, almond, plum, nectarine, peach, apricot, cherry, berries, and more. The company runs its own active breeding program and holds patents for several innovative stone fruit varieties. BETA operates a state-of-the-art tissue culture laboratory with an annual capacity of 3 million units, specializing in clonal rootstocks such as Garnem, GF, 29C, and Gisela. In addition to plant production, BETA designs and implements turnkey irrigation systems and provides technical consultancy to growers. With extensive experience in propagation, breeding, and orchard development, BETA serves both domestic and international markets. Today, the company exports to over 25 countries, supplying high-quality plant material backed by professional engineering team. Committed to innovation, reliability, and long-term grower success, BETA continues to be a trusted partner in modern fruit production."
59,C-Lines International,1-552,Poultry Livestock & Dairy Farming,"Livestock Technologies, Poultry Systems & Technologies",France,www.c-lines.com,http://www.c-lines.com,C-Lines International,"C-LINES International is a French engineering company and a leading provider in the prefabricated buildings for the agri-food and livestock’s sector, with over 5 million square meters built in more than 60 countries.The C-LINES concept is based on an advanced structural engineering process and a comprehensive 3D building modeling approach. Our mission is to deliver reliable and customizable structures that meet the specific needs of our clients while ensuring the welfare of the animals. We design and produce livestock buildings for all turnkey solutions: such as hatcheries, breeders, broilers, layer houses, warehouses, processing houses, packing station and all types of industrial buildings.Livestock building: With a focus on the broiler industry, egg layers, swine, and other animal rearing sectors, we offer innovative solutions that combine quality, durability, and efficiency.Hatcheries: C-Lines International designs and constructs hatcheries for the poultry industry. Our hatchery buildings are equipped with state-of-the-art incubation systems, climate control, and biosecurity measures to ensure optimal conditions for the successful hatching and rearing of chicks.Slaughterhouses: We provide specialized buildings for the efficient and hygienic processing of livestock. Our slaughterhouse structures are designed to meet industry regulations, incorporating features such as temperature control, sanitary facilities, and optimized workflow.Cold Rooms and Storage Facilities: C-Lines International offers custom-designed cold rooms and storage facilities for the agri-food industry. These structures are equipped with temperature control systems, insulation, and efficient storage solutions to preserve the quality and freshness of perishable goods."
60,Candem Gübre A.Ş,5-218,,,Turkiye,,,Candem Gübre A.Ş,
61,CheonjiBio,1-188,,,South Korea,,,,
62,"China Green Intelligent Agricultural Co., Ltd.",1-470,"Organic & Agro-Food, Agriculture Technologies, Aquaculture, Crop Farming","Dairy Products, AI & Smart Applications, Drones, Greenhouses Solutions, Hydroponics, Smart Farming, Smart Irrigation, Vertical Farming, Aquaculture Materials, Aquaculture Systems & Technologies, Crop Protection, Farming Technologies, Fertilizers & Pesticides, Landscaping & Nurseries",China,www.greenagro-cn.com,http://www.greenagro-cn.com,"China Green Intelligent Agricultural Co., Ltd.","Founded in 2011, China Green Agro is a national high-tech enterprise mainly engaged in agricultural investment, park construction, operation management and intelligent equipment research and development.China Green Agro gives full play to its research and development advantages in the field of modern agricultural equipment technology, has obtained nearly 100 national patents, and completed more than ten national scientific research projects and technology project development. The products are widely used in agricultural production, sightseeing, smart cities, scientific research experiments and many other fields. We have rich experience in agricultural facility automation, information integration, and sustainable profitability in agricultural parks, meeting the needs of customer groups in different countries."
63,"Chuangjing Agricultural Equipment Group Co., Ltd.",1-296,,,China,,,"Chuangjing Agricultural Equipment Group Co., Ltd.",
64,"Coatgreen Co., Ltd.",1-173,,,South Korea,,,,
65,Code Alnumui Company,1-319,,,Saudi Arabia,,,Code Alnumui Company,
66,Cravo Equipment Ltd.,1-282,Agriculture Technologies,Greenhouses Solutions,Canada,www.cravo.com,http://www.cravo.com/,Cravo Equipment Ltd.,"Cravo is a 45-year-old Canadian, family-run business with over 40 years of experience in the design and manufacturing of automatic retractable roof greenhouses, cooling houses and retractable field covering systems. We are active globally with installations on 6 continents covering vegetables, berries, cherries, tree nurseries, flowers, ornamentals, and perennials.Our intensive focus on how to create the best possible growing environment has resulted in over 75 different retractable roof solutions comprising of 5 different structures, 11 different coverings and 1-3 layers. This level of customization allows our customers to grow better crops and extend harvest seasons in temperate, desert, tropical and semi tropical locations using minimal water and electricity. While our expertise in the design and manufacture of retractable roof houses is recognized globally, what really sets us apart is our extensive experience in how to use the retractable roofs to manipulate the growingenvironment to achieve superior results."
67,Daeyang Corporation,1-190,,,South Korea,,,,
68,Dairy Farms Supporting Center,1-310,"Organic & Agro-Food, Poultry Livestock & Dairy Farming","Dairy Products, Feeds & Additives, Livestock Technologies",Saudi Arabia,,,Dairy Farms Supporting Center,"The Dairy Farms Supporting Center is one of the branches of Abdullah bin Mohammed Al-Tukhaim and Sons - a closed joint stock company. It is a long-standing activity in the field of agricultural production and has extensive experience in the production of dairy products and diverse agricultural materials extending for more than 48 years, particularly in the field of milk production and various agricultural products. The Dairy Farms Supporting Center has its roots deep in the veterinary market in the Kingdom for over 38 years of excellence and leadership, and in 1997, the Supporting Center merged with Al-Tukhaim Group, achieving brilliance and success together. The Supporting Center is an authorized dealer and distributor for global European companies, focusing on meeting the needs of dairy farms and livestock farms. This includes veterinary tools, vaccinations, dairy substitutes, and essential nutrients, as well as various vaccines for cattle and veterinary equipment, including artificial insemination tools, milking machinery for cows and sheep, calf feeding machines, cow and livestock numbering equipment, and feed additives and inputs such as cottonseed, in addition to mixing and feed production machines."
69,Dar Al-Alaf Agricultural Company,5-318,,,Saudi Arabia,,,Dar Al-Alaf Agricultural Company,
70,Dava Agricultural Co.,4-339,,,Saudi Arabia,www.dava.sa,http://www.dava.sa/,Dava Agricultural Co.,
71,"Desert Hills for Veterinary Co., Ltd. (Tanmiah)",1-240,"Poultry, Livestock & Dairy Farming",Animal Health & Technologies,Saudi Arabia,tanmiah.com/desert-hills-for-veterinary-services-company-ltd,http://tanmiah.com/desert-hills-for-veterinary-services-company-ltd,"Desert Hills for Veterinary Co., Ltd. (Tanmiah)",
72,Desert Ship Import & Export Company,5-102,,,Algeria,,,Desert Ship Import & Export Company,
73,DOF Ltd.,1-176,,,South Korea,,,,
74,Dotra Chemicals,4-496,,,Egypt,,,,
75,"ECC Co., Ltd.",1-189,,,South Korea,,,,
76,Egyptian German Co. for Agricultural Production,3-181,,,Egypt,,,,
77,EJADA Commercial Labs (FEEDCO Investment Company),4-160,,,Saudi Arabia,,,EJADA Commercial Labs (FEEDCO Investment Company),
78,Eminel Tarim Hayvancilik Ürünleri İnş. San Ve Tic A.Ş,3-296,,,Turkiye,,,Eminel Tarim Hayvancilik Ürünleri İnş. San Ve Tic A.Ş,
79,"Era Piping (Zhejiang) Co., Ltd",1-376,,,China,,,"Era Piping (Zhejiang) Co., Ltd",
80,Erad United Trading Company (ERADCO),4-430,"Agriculture Technologies, Crop Farming","Greenhouses Solutions, Crop Protection, Farming Technologies, Fertilizers & Pesticides, Landscaping & Nurseries",Saudi Arabia,www.eradunited.com,http://www.eradunited.com,Erad United Trading Company (ERADCO),"Erad United Trading Co. (ERADCO), founded in 1983 (1402H) for integrated agricultural supplies. The company’s trading portfolio includes Importing and marketing of:• Compound and straight fertilizers in soluble and granular forms.• Outdoor and indoor seeds including organic seeds.• Agricultural pesticides including Insecticides Fungicides, Herbicides• Public health pesticides and its equipments, and Veterinary products.ERADCO Subsidiaries:Khairat Agri Al-Khairat Modern Agricultural Co. was founded in 1988 for modern operation & Management of Agricultural farms - using our vast know - how to produce and market vegetable specialties, flowering pots, nurseries and indoor plants. KasrChem Gulf Palace Fertilizers Co. Founded in 2002 For production of a wide range of different types of fertilizers includes, NPK’s soluble fertilizers, suspension & liquid fertilizers, growing media and plant bio-stimulants."
81,Evergrow for Speciality Fertilizers,1-280,,,Egypt,,,Evergrow for Speciality Fertilizers,
82,EVYP Crop Biostimulation Technologies,4-493,,,Greece,evyp.gr,http://evyp.gr/,EVYP Crop Biostimulation Technologies,
83,Fakieh Poultry Farms CJSC,1-210,"Organic & Agro-Food, Poultry Livestock & Dairy Farming","Meat Products, Poultry & Fish Products, Chilled & Frozen Foods, Poultry Production",Saudi Arabia,www.fakiehfarms.com,http://www.fakiehfarms.com,Fakieh Poultry Farms CJSC,"Fakieh Poultry Farms established 65 years ago, is ranked as one of the top Poultry Production companies in the Middle East. The most important characteristic of this firm is the integration of poultry industry, as Fakieh farms, owns and controls all production stages of meat and egg, starting from the GP, Breeders, Broiler farms, incubators, slaughterhouses, and Feed productions up to the transportation and finally storage.With an annual production capacity of 110 million birds, 500 million table eggs and 1,000,000 tons of poultry feed.At the same time to get rid of wastes properly and in environmentally friendly manner Fakieh’s established a factory for organic fertilizers and rendering plants in order to complete the cycle of production.that proves healthy and fresh poultry adhering to international standards with affordable priceOur strict quality control measures means that every single item Produced by our plants adheres to international standards, offering 100% healthy and natural chicken products.Our concerted efforts are directed towards producing the finest poultry products while reducing waste and decreasing the use of natural resources.Our chicken feed is based on corn, soy, vitamins and minerals, Fakieh chicken's feed is 100% natural and; it is free of all kinds of animal by- Product."
84,Famsun Co. Ltd. (Al Khumasia),1-369,"Poultry, Livestock & Dairy Farming",Livestock Technologies,Saudi Arabia,www.famsungroup.com,http://www.famsungroup.com,Famsun Co. Ltd. (Al Khumasia),
85,FEEDCO Investment Company,2-210,,,Saudi Arabia,,,FEEDCO Investment Company,
86,First Mills Company,1-130,Poultry Livestock & Dairy Farming,"Animal Health & Technologies, Feeds & Additives",Saudi Arabia,www.firstmills.com,http://www.firstmills.com,First Mills Company,"Founded in 2017 as a result of the privatization of the General Food Security Authority (GFSA), First Mills is one of the cornerstones of Saudi Arabia's strategic food security ecosystem. The Company is a market-leading milling player in the Kingdom, incorporating innovative solutions to produce the highest quality flour, feed, bran and wheat derivatives. The Company covers all major regions of the Kingdom through four strategically located, large-capacity mills in Jeddah, Qassim, Tabuk, and Al-Ahsa. At First Mills, quality comes first in everything we do. Our ambition is to be the first choice for premium food and feed products in Saudi Arabia and the region."
87,G and N Fortune Limited,5-239,"Agriculture Technologies, Poultry Livestock & Dairy Farming, Aquaculture, Crop Farming","Hydroponics, Smart Farming, Smart Irrigation, Vertical Farming, Livestock Technologies, Aquaculture Materials, Farming Technologies",China,www.gnhydroponic.com,http://www.gnhydroponic.com,G and N Fortune Limited,"G And N Fortune Limited was founded in 1996, Which mainly specializes in NFT hydroponic system, PVC/PPR water supply and drainage pipe & fittings, Witch 55 automated assembly lines, 8 national patents and best service with professional sales team. Our products have been exported to more than 70 countries and regions, And the annual output value up to $30,000,000.G And N has independent design patents for the NFT hydroponic system, Many styles for leaf vegetable's NFT hydroponic system, Such as ""A"" style, Horizontal style and ""I"" style and so on. For the vine vegetable, Such as the tomato/cucumber we also have the dutch bucket and different sizes of substrate gutters to meet different requirements from customers. For nursery, we can offer customized nursery systems such gutter system, flood tray system, floating raft, NFT system, etc. What's more, we have our own greenhouse with 2,400 sqm and could offer support in full aspects for our customers such as complete system design, assembly instruction and planting technology support. You are welcome to visit us and discuss the cooperation."
88,General Food Security Authority (GFSA),2-160,Official Agency,Government Agency,Saudi Arabia,www.gfsa.gov.sa,http://www.gfsa.gov.sa,General Food Security Authority (GFSA),"General Food Security Authority (formerly known as the Saudi Grains Organization) is a Saudi government Authority that was transformed into its new name by a Royal Approval from the Council of Ministers on 17 January 2023. The Authority works on achieving economic development and providing the needs of the population of the Kingdom of Saudi Arabia from the basic food commodities. In addition to regulating, developing and enhancing the Kingdom’s food security, as well as coordinating and unifying efforts among the agencies concerned with the food security system from the public and private sectors."
89,Golden Gulf Veterinary Company,4-294,,,Saudi Arabia,,,Golden Gulf Veterinary Company,
90,Grain Technik Pvt. Ltd.,1-449,,,India,,,Grain Technik Pvt. Ltd.,
91,Green Building Agricultural Est. (Bunyan Al Riyadh),4-260,"Agriculture Technologies, Crop Farming, Agro-Food Processing & Packaging, Aquaculture","Greenhouses Solutions, Crop Protection, Landscaping & Nurseries, Agro-Food Packaging, Refrigeration & Storage, Aquaculture Materials, Aquaculture Systems & Technologies",Saudi Arabia,,,Green Building Agricultural Est. (Bunyan Al Riyadh),"A leading and specialized Group in the cultivation and supply of ornamental plants and professional landscaping services for all sectors and projects in the Kingdom and the region, powered by deep expertise and the latest agricultural technologies."
92,Green Footprint Agricultural Company,4-120,Crop Farming,,Saudi Arabia,,,Green Footprint Agricultural Company,"Ghars Company, a Specialist on Tomatoes, Cherry and Big Tomatoes Production for 25-thousand-meter square by Greenhouse System, High Tech Agriculture."
93,Green Plains Projects,5-253,,,Oman,,,Green Plains Projects,
94,Gruppo Carli (SICEM Srl),2-282,,,Italy,,,Gruppo Carli (SICEM Srl),
95,"Guniverse Intelligent Agricultural Tech Co., Ltd.",1-475,Agriculture Technologies,"Greenhouses Solutions, Hydroponics, Smart Farming",China,www.guniver.com,http://www.guniver.com,"Guniverse Intelligent Agricultural Tech Co., Ltd.","Guniverse has a proven track record of delivering successful projects worldwide. With over 700 completed projects in more than 60 countries, we offer greenhouse facilities and comprehensive services to empower growers with the knowledge and skills needed to maximize productivity. Guniverse, legally owns the renowned greenhouse brand and trademark of [Trinog] which currently enjoys high brand awareness and significant market share in both domestic and overseas markets."
96,Hamoud Ali Al Khalaf & Partner Co.,4-460,"Poultry, Livestock & Dairy Farming","Livestock Systems & Technologies, Animal Health & Nutrition, Fertilizers & Pesticides",Saudi Arabia,www.alkhalaf-hk.com,http://www.alkhalaf-hk.com/,Hamoud Ali Al Khalaf & Partner Co.,
97,Hanearl Science Ltd.,1-184,,,South Korea,,,,
98,"Hebei Shengshi Jintang Packaging Co., Ltd.",1-394,Agro-Food Processing & Packaging,"Agro-Food Packaging, Agro-Food Production & Processing",China,www.ppwovenbag.com,http://www.ppwovenbag.com,"Hebei Shengshi Jintang Packaging Co., Ltd.","We are delighted to provide our clients with premium AD*STAR® bags, PP Woven bags, BOPP laminated bags, Block Bottom bags, Big bags/ FIBC, and PP Woven fabric rolls, meticulously designed to cater to the specific demands of various sectors.With over four decades in the industry, we have always pursued excellence in quality, walking with the industry through every stage of its growth. Delivering over 300 million bags every year, we are pursuing to be one of the leading enterprises with global footprints. Choose us for high-quality and reliable packaging solutions."
99,"Heilongjiang Huida Technology Co., Ltd.",1-474,,,China,,,"Heilongjiang Huida Technology Co., Ltd.",
100,Hekagro Solutions Tarim Teknoloji San Ve Tic A.Ş,3-281,,,Turkiye,,,,
101,"Helper Robotech Co., Ltd.",1-185,,,South Korea,,,,
