raw_row_number,company_name_raw,stand_no,sector,products,country,website_text,website_url,company_column,details
102,"Henan Yutuo Agricultural Technology Co., Ltd.",1-370,Agriculture Technologies,Greenhouses Solutions,China,www.ytgreenhouses.com,http://www.ytgreenhouses.com,"Henan Yutuo Agricultural Technology Co., Ltd.","Henan Yutuo Agricultural Science and Technology Co., LTD., founded in 2011, is a company specializing in promoting modern agricultural products, focusing on the greenhouse industry, committed to the modernization of agricultural facilities, with a professional team, Serving over 130 countries and regions worldwide. Mainly provide film greenhouses, glass greenhouses, PC greenhouse, solar panel greenhouse and relative equipment. Our company service concept is: ""Reputation First, Customer First"" – Delivering Gold Standard Services."
103,Hippos Agricultural and Industrial company,5-114,,,Jordan,,,Hippos Agricultural and Industrial company,
104,Holol Attarsheed Trading Est.,4-170,,,Saudi Arabia,,,Holol Attarsheed Trading Est.,
105,Hyma Plastic Hyma Foam,5-118,,,Egypt,,,Hyma Plastic Hyma Foam,
106,ICS-Canahill Agricultural Est.,5-339,Crop Farming,Seeds,Saudi Arabia,www.ics-can.com.sa,http://www.ics-can.com.sa,ICS-Canahill Agricultural Est.,
107,İjan Sera Sis San Tic A.Ş,5-215,,,Turkiye,www.ijan.com.tr,http://www.ijan.com.tr/,İjan Sera Sis San Tic A.Ş,
108,Jenincoor International B V Foreign Company,5-230,Feeds & Mills,Feeds & Additives,Saudi Arabia,,,Jenincoor International B V Foreign Company,
109,Jerim Metal Co.,1-191,,,South Korea,,,,
110,"Jiangsu Sunrise Environmental Technology Co., Ltd.",1-393,,,China,,,"Jiangsu Sunrise Environmental Technology Co., Ltd.",
111,"Jordan Greenhouses Manufacturing Co., Ltd.",4-379,"Agriculture Technologies, Crop Farming, Poultry Livestock & Dairy Farming","Greenhouses Solutions, Crop Protection, Farming Technologies, Fertilizers & Pesticides, Landscaping & Nurseries, Livestock Technologies, Poultry Systems & Technologies",Jordan,www.rayyan.com.jo,http://www.rayyan.com.jo/,"Jordan Greenhouses Manufacturing Co., Ltd.","Jordan Greenhouses, member of Munir Sukhtian International Holdings Group is the first greenhouses manufacturing company in the Middle East region, since its establishment in 1980, the company has worked to satisfy the growing needs for greenhouses for local and international clients. Leaded by a highly qualified team, the company has developed the greenhouses product range and integrated top-of-the-line technologies with the greenhouses structure to provide turnkey solutions that suit the special requirements of different regions and climates. The in-house engineering department is comprised of designers, engineers, systems integration specialists, and project managers. Our engineering team works closely with our clients, technology partners and consultants to determine the greenhouse system solution of high quality, optimum cost and maximum return on investment. The company has always succeeded in being the trusted partner for its clients."
112,Kayes Arabia for Trading Co.,5-319,Crop Farming,Farming Technologies,Saudi Arabia,www.kayesonline.com,http://www.kayesonline.com/,Kayes Arabia for Trading Co.,
113,Kemyea Yanbu for Industry (KEMYAN),1-339,"Organic & Agro-Food, Crop Farming","Dairy Product, Spices & Oil, Fertilizers & Pesticides",Saudi Arabia,www.kemyan.com,http://www.kemyan.com,Kemyea Yanbu for Industry (KEMYAN),"Agriculture and industrial in Kingdom of Saudi Arabia having un-limited support from government authority to satisfy food security and Diversification of national income sources through proper investment what God gave a wealth of nature. KEMYAN aspiring to be main supplier for food security in kingdom of Saudi Arabia and to be one of the leaders to close the food gap in Middle East. KEMYAN recently supplied a product that is being used widely in fertilizer and food security in the region with premium quality and optimum price without impacting our environment focusing on phosphate base products such GSSP, NPK, DI and Mono Calcium Phosphate."
114,"Korea Bio Co., Ltd.",1-175,,,South Korea,,,,
115,Korea Rural Community Cooperation,1-182,,,South Korea,,,,
116,KWAG,1-292,,,USA,,,KWAG,
117,La Meccanica SRL Di Reffo,4-471,Poultry Livestock & Dairy Farming,"Poultry Systems & Technologies, Livestock Technologies",Italy,lameccanica.it,http://www.lameccanica.it/,La Meccanica SRL Di Reffo,"La Meccanica Srl has been operating in animal feed for more than sixty years. Our company specializes in the construction of machinery with high quality standards for pellet production. Design and production are performed in-house ensuring real-time control over quality. The fully automated production plant with avant-garde technologies produce dies, rolls and spare parts for all the main brands of pellet mills. Precision, quality and technology have always distinguished our company. La Meccanica Network is well installed in 60 countries with 28 agents and distributors. In recent years we have opened 8 offices around the world, where skilled technicians carry out an efficient and fast technical service directly at the customer site. La Meccanica technologies are valuable for the animal, for people and for the world we live in.We stand for innovation and desire to build an eco-sustainable world."
118,Ladina for Industry (Saf-Sudair For Plastic Industries Co.),4-115,Agriculture Technologies,Greenhouses Solutions,Saudi Arabia,safsudair.com,http://safsudair.com/,Ladina for Industry (Saf-Sudair For Plastic Industries Co.),
119,Laoying S.A. (Juan Carlos Parra Perez),1-570,,,Mexico,,,Laoying S.A. (Juan Carlos Parra Perez),
120,Leha Agriculture Trading & Marketing,1-510,Crop Farming,Seeds,Saudi Arabia,,,Leha Agriculture Trading & Marketing,
121,Lubing System Srl,4-482,Agriculture Technologies,"Greenhouses Solutions, Hydroponics",Italy,lubing-greentec.net,http://lubing-greentec.net,Lubing System Srl,LUBING GreenTec designs and manufactures Systems for industrial greenhouses such as humidification and cooling systems for plant and flower production.
122,Maghateer Trad. Est.,4-369,Crop Farming,Fertilizers & Pesticides,Saudi Arabia,www.maghateer.co,http://www.maghateer.co/,Maghateer Trad. Est.,
123,Makrokim Kimyasal Maddeler San Tic A.Ş,5-349,,,Turkiye,,,Makrokim Kimyasal Maddeler San Tic A.Ş,
124,Masa Pest Control Establishment For Agricultural Pesticides,5-133,Crop Farming,Pest Control,Saudi Arabia,www.masapestcontrol.com.sa,http://www.masapestcontrol.com.sa,Masa Pest Control Establishment For Agricultural Pesticides,"MASA Pest Control Establishment is a 100% Saudi-owned company, fully managed and directed by Mr. Mousaied S. Alshieshakly, and has been serving the Kingdom since its establishment in 1980. Over the decades, MASA has built a solid and trusted reputation in the Saudi pest control industry by maintaining the highest standards of quality and service excellence, ensuring effective and reliable results for its clients. Our extensive portfolio of successfully completed projects—along with many ongoing and upcoming contracts—demonstrates the confidence our clients place in us. This long list of satisfied customers includes not only individual residents but also leading names across various sectors, both private and public. MASA’s success is backed by a team of highly qualified professionals and a commitment to delivering world-class pest control solutions at reasonable and competitive costs. We continue to uphold these values as we expand our services and strengthen our leadership in the industry."
125,Matar Tarim Ürünleri Paz İnş Tur Hay Analizleri San Ltd Şti,3-182,,,Turkiye,,,,
126,MDT Denge Tarim Müh San. Ve Tic. Ltd. Şti.,5-348,Crop Farming,Fertilizers & Pesticides,Turkiye,www.dengetarim.com.tr,http://www.dengetarim.com.tr,MDT Denge Tarim Müh San. Ve Tic. Ltd. Şti.,"Denge Tarım has 4 group companies in Turkey, as well as sales offices in Florida (USA) and Romania — a total of 6 group companies.Our group employs 120 colleagues and produces more than 200 different products.We export these products to more than 25 countries.We are the largest manufacturer of biological fertilizers in Turkey and Europe. Our products are of very high quality and offered at competitive prices. We also produce organic fertilizers, water-soluble fertilizers, biostimulants, and more."
127,Mekoser Seracilik San Ve Tic Ltd Şti,3-280,,,Turkiye,,,,
128,Menarat Al Haouz Travaux,4-483,,,Morocco,,,Menarat Al Haouz Travaux,
129,"Ministry Of Environment, Water & Agriculture (MEWA)",2-140,Official Agency,,Saudi Arabia,www.mewa.gov.sa,http://www.mewa.gov.sa/,"Ministry Of Environment, Water & Agriculture (MEWA)",
130,Mishkat Agritech Farm,5-139,,,Saudi Arabia,,,,
131,Mixscience / Nemow Al Amaal,4-299,"Poultry, Livestock & Dairy Farming",Animal Health & Technologies,Saudi Arabia,www.nemowaamaal.com,http://www.nemowaamaal.com/,Mixscience / Nemow Al Amaal,
132,Modern Mills Company,3-210,Feeds & Mills,Feeds & Additives,Saudi Arabia,www.modernmills.com.sa,http://www.modernmills.com.sa/,Modern Mills Company,
133,Mood Integrated Design (Saudi Reef),2-269,Official Agency,Government Agency,Saudi Arabia,beinmood.com,http://beinmood.com,Mood Integrated Design (Saudi Reef),"Mood Design is a company specialized in advertising, media, and the organization of conferences and events. It was established in 2016 under Saudi management. The company is responsible for representing the Sustainable Rural Agricultural Development Program (Reef Saudi) by supporting its participation in events and enhancing its presence across various digital media platforms."
134,Mosa Green SRL,4-473,,,Italy,,,Mosa Green SRL,
135,"Mr. Innovation Co., Ltd.",1-171,,,South Korea,,,,
136,Mulmix SRL,4-486,Agro-Food Processing & Packaging,"Agro-Food Production & Processing, Refrigeration & Storage",Italy,www.mulmix.it,http://www.mulmix.it,Mulmix SRL,"Mulmix is an Italian company specialized in the engineering, production, and supply of complete systems for grain storage and processing. Our range includes silos, dryers, conveyors, and turnkey plants tailored to both agricultural and industrial needs.We serve inland grain terminals, port facilities, grain traders, mills, oilseed processors, feed manufacturers, and seed selection centres. We also specialize in the revamping of obsolete facilities.With over 2,000 customers in more than 70 countries, Mulmix offers customized, reliable, and efficient solutions grounded in decades of experience and technical know-how.From design to installation and modernization, we integrate Italian engineering with innovation and precision, helping clients optimize their operations and protect product quality.Mulmix stands for excellence, flexibility, and long-term partnerships in the grain industry."
137,NakheelAgri Agricultural Company,4-230,Crop Farming,Fertilizers & Pesticides,Saudi Arabia,,,NakheelAgri Agricultural Company,"• NakheelAgri has been in the Saudi Arabia market for nearly four decades since its foundation back in 1981.• Although our nation is largely associated with desert, many of its regions possess climate suitable for agriculture.• NakheelAgri is the official distributor of Yara & Syngenta, the world’s leading fertilizer company."
138,Nano Farm Kimya Ve Tarim Pazarlama San Tic Ltd Sti,3-275,,,Turkiye,,,,
139,Napco National Packaging,4-270,"Agriculture Technologies, Crop Farming, Agro-Food Processing & Packaging, Aquaculture","Greenhouses Solutions, Hydroponics, Smart Farming, Smart Irrigation, Crop Protection, Agro-Food Packaging, Aquaculture Materials",Saudi Arabia,www.napconational.com,http://www.napconational.com/,Napco National Packaging,"With over 70 years of industry leadership, Napco Packaging provides advanced agricultural packaging and film solutions that boost productivity and environmental performance. We support growers, exporters, and distributors with a comprehensive range of products including shade and anti-insect nets, palm net bags, greenhouse and low tunnel films, mulch films, ground covers, soil disinfection films, HDPE geomembranes, water tubes, and animal feed bags. Designed for durability and ease of use, our solutions help protect crops from pests and harsh climates, while improving water and soil management and preserving produce quality. Driven by innovation, Napco Packaging partners with customers to deliver customized answers to today’s agricultural challenges. In alignment with Saudi Vision 2030, we contribute to national objectives of agricultural advancement, food resilience, and economic diversification. Backed by decades of expertise and a strong regional presence, we remain a dependable ally in cultivating a more sustainable future for agriculture across the region."
140,National Agricultural Development Co. (NADEC),3-140,"Organic & Agro-Food, Crop Farming, Poultry Livestock & Dairy Farming, Agro-Food Processing & Packaging, Aquaculture","Fresh Foods, Dried & Canned Foods, Meat Products, Poultry & Fish Products, Dairy Products, Frozen Foods, Spices & Oil, Crop Farming Technologies, Greenhouses Solutions, Irrigation Solutions, Fertilizers & Pesticides, Crop Protection, Livestock Technologies, Animal Health & Nutrition, Dairy Processing & Production, Agro-Food Production & Processing, Agro-Food Packaging Equipment, Agro-Food Packaging Supplies, Refrigeration & Storage, Aquaculture Systems & Technologies, Aquaculture Materials",Saudi Arabia,www.nadec.com,http://www.nadec.com,National Agricultural Development Co. (NADEC),"Nadec’s journey of success spans over 44 years, during which it has achieved numerous remarkable milestones that have established its brand as one of the leading national companies in the agricultural and food sectors across the Kingdom and the region. This contributes to enhancing food security and supports the goals of Saudi Vision 2030.Nadec’s product portfolio includes agricultural crops, olive oil, vegetables, a wide range of dairy products, juices, and red meat. The company also owns integrated agricultural and food operations across dairy farms and crop production, within four major agricultural and food projects located in Wadi Al-Dawasir, Haradh, Hail, and Al-Jouf."
141,National Center For Palms & Dates (NCPD),4-340,Official Agency,Government Agency,Saudi Arabia,ncpd.gov.sa,http://ncpd.gov.sa,National Center For Palms & Dates (NCPD),"A government center established for the purpose of developing the palm and dates sector in Saudi Arabia and we aim to be a primary center for the development and sustainability of the Saudi palm and dates sector, so that the Kingdom's dates are the first choice in the world by creating an integrated system of agricultural, marketing and knowledge services and adopting modern technologies to achieve production efficiency and increase the rate of consumption of Saudi dates locally and internationally."
142,National Company for Agricultural Services (Agriserv),3-110,"Agriculture Technologies, Crop Farming, Poultry Livestock & Dairy Farming, Official Agency","AI & Smart Applications, Greenhouses Solutions, Smart Farming, Fertilizers & Pesticides, Animal Health & Technologies, Government Agency, Agricultural Services",Saudi Arabia,www.agriserv.sa,http://www.agriserv.sa,National Company for Agricultural Services (Agriserv),"The National Company for Agricultural Services (AgriServ) is a government-owned company established by a cabinet resolution under the Agricultural services transformation program. AgriServ aims to provide high-quality and sustainable services to enable individuals and commercial facilities in the agricultural sector to improve operational efficiency, increase quality and productivity, and achieve positive impact on those working in the sector. The company delivers number of services assigned by the Ministry of Environment, Water and Agriculture. Which include the issuance of licenses, permits and certificates, quarry services, veterinary clinic services, disease and pest control, consultations and Agricultural marketing, services of public benefit markets and slaughterhouses. In addition to providing value-added services to achieve operational efficiency and increase customer satisfaction in the agricultural sector. The company prioritizes customers’ business growth and seeks to provide services that meet their needs and contribute to the sector's development and sustainability."
143,National Grain Supply Company (SABIL),2-130,Official Agency,Government Agency,Saudi Arabia,sabil.com.sa,http://sabil.com.sa/,National Grain Supply Company (SABIL),"The National Grain Supply Company, ""SABIL"" is a SALIC Group subsidiary wholly owned by the Public Investment Fund (PIF). SALIC established it following Cabinet Resolution No. 440 dated 24/6/1444H - 17/1/2023, which mandated the transformation of the Saudi Grains Organization into the General Food Security Authority. The resolution also transferred the operational responsibilities of grain silos, including wheat procurement and strategic storage, from the Authority to SALIC.SABIL will oversee the operational management of grain facilities across all silo branches in various regions of Saudi Arabia. It will maintain the required strategic reserves in alignment with Saudi food security requirements. Furthermore, SABIL aims to enhance operational efficiency, enabling local farmers and milling companies to ensure sustainable supply chains."
144,National Research and Development Center for Sustainable Agriculture,2-260,Official Agency,Government Agency,Saudi Arabia,estidamah.gov.sa,http://estidamah.gov.sa,National Research and Development Center for Sustainable Agriculture,"The National Center for Research and Development of Sustainable Agriculture (Estidamah) is a specialized center focused on supporting applied research and innovation in the field of sustainable agriculture. It aims to enhance food security, improve the efficiency of natural resource utilization, and promote modern agricultural technologies in line with the goals of the National Agricultural Strategy and the National Food Security Strategy.Estidamah houses advanced research facilities including smart greenhouses, tissue culture laboratories, and precision agriculture technologies. The center engages in national and international scientific collaborations and provides training programs and workshops tailored for farmers, researchers, and investors."
145,"Ningbo Master Irrigation Gardening Equipment Co., LTD.",1-478,Agriculture Technologies,Smart Irrigation,China,www.yymaster.com,http://www.yymaster.com/,"Ningbo Master Irrigation Gardening Equipment Co., LTD.","NINGBO SENNINGER IRRIGATION GARDENING EQUIPMENT CO., LTD is a manufacturer specialized in producing water-saving irrigation equipments, sprinkler equipments and micro-drip irrigation equipments. Products are made of solid durable engineering plastic, zinc alloy and high-quality all-brass material. All products have precise designs and advanced manufacturing processes, with reliable quality and best price, suited to China's national conditions. They are used for the irrigation of agriculture, flowers, landscape, the stadium, greenhouse, the courtyard, the golf course and the industry of temperature decrease dust removal and so on."
146,"Ningbo Salvador Piping System Co., Ltd.",1-378,,,China,,,"Ningbo Salvador Piping System Co., Ltd.",
147,"Ningbo Sino Tech&Delp Co., Ltd.",1-395,"Agriculture Technologies, Crop Farming","Smart Farming, Smart Irrigation, Farming Technologies, Landscaping & Nurseries",China,sinoirrigation.com,http://sinoirrigation.com,"Ningbo Sino Tech&Delp Co., Ltd.",
148,"Ningbo Yinzhou Yash Import& Export Co., Ltd.",5-236,,,China,,,"Ningbo Yinzhou Yash Import& Export Co., Ltd.",
149,"Ningxia Sloan Technology Co, Ltd",5-235,,,China,,,"Ningxia Sloan Technology Co, Ltd",
150,Nuha Othman Al Badr Est.,5-334,Crop Farming,,Saudi Arabia,,,Nuha Othman Al Badr Est.,
151,Oman Flour Mills Company,1-293,,,Oman,,,Oman Flour Mills Company,
152,One Agro Kimya San Tic A.Ş,3-250,,,Turkiye,,,One Agro Kimya San Tic A.Ş,
153,P.TRE Greenline,4-480,Agriculture Technologies,"Greenhouses Solutions, Hydroponics",Italy,www.ptregreenline.it,http://www.ptregreenline.it,P.TRE Greenline,"P.TRE is a leading company in the production of systems for hydroponic cultivation in greenhouses, active all over the world.Thanks to many years of experience acquired in sheet metal processing and the most modern technology available in wire bending, P.TRE is able to offer specific products and accessories to study each individual need side by side with the grower."
154,Pioneer Water Tanks,5-147,,,UAE,,,Pioneer Water Tanks,
155,"Prasada (Xiamen) Agricultural Engineering Co., Ltd.",1-460,,,China,,,"Prasada (Xiamen) Agricultural Engineering Co., Ltd.",
156,Precia Molen,3-194,,,France,,,Precia Molen,
157,Pyung Hwa Industry,1-187,,,South Korea,,,,
158,Qetaf Jordan Company for Industry,4-269,Agriculture Technologies,Greenhouses Solutions,Saudi Arabia,www.qetafjo.com,http://www.qetafjo.com/,Qetaf Jordan Company for Industry,"Qetaf Company specializes in the manufacturing of greenhouses and greenhouse supplies, including iron structures, various types of greenhouse coverings, cooling and heating components, and everything related to greenhouses, such as seeds, fertilizers, and irrigation networks. We provide everything a farmer needs under the name of Qetaf Jordanian Company in all its departments."
159,"Qinhuangdao Lito Technology Co., Ltd.",1-295,,,China,,,"Qinhuangdao Lito Technology Co., Ltd.",
160,RABL Agriculture Company (United Agricultural Company),5-369,"Agriculture Technologies, Crop Farming","Drones, Fertilizers & Pesticides",Saudi Arabia,www.rablagri.com,http://www.rablagri.com,RABL Agriculture Company (United Agricultural Company),"RABL Agriculture Company is a leading Saudi company specializing in agricultural inputs and advanced farming technologies. Since 2013, we have been dedicated to supporting farmers across the Kingdom by providing premium fertilizers, pesticides, seeds, and innovative agricultural equipment. Through strong partnerships with global manufacturers, we deliver sustainable solutions that enhance productivity, crop quality, and environmental responsibility. RABL also invests in R&D, farmer training, and modern production facilities, including our fertilizer factory, nursery, and seed trial station, to ensure continual improvement and food security. Our mission is to lead agricultural innovation in Saudi Arabia by offering safe, sustainable, and effective solutions for a growing future."
161,RAD Global Pvt. Ltd.,3-180,Crop Farming,Crop Protection,India,radglbl.com,http://radglbl.com,RAD Global Pvt. Ltd.,"We are a vertically integrated unit equipped with advanced multi-layer film extrusion, monofilament extrusion lines, German Karl Mayer knitting machines, and heat stenter machines. Our company specializes in manufacturing netting solutions for multiple industries, with the construction sector being one of our key verticals.Our products find applications in the following sectors:a) Constructionb) Fencingc) Agriculture and Horticultured) Outdoor and HomeWe offer knitted nets in both Tape and Monofilament categories, available in 6 and 9-gauge varieties. Our shade nets range from 38 GSM to 410 GSM, with options for UV protection lasting up to 10 years and shading levels of up to 99%."
162,Rafed Agricultural Company,5-137,Agriculture Technologies,"Greenhouses Solutions, Hydroponics",Saudi Arabia,rafedagri.com,http://rafedagri.com/,Rafed Agricultural Company,"Rafed Agricultural Company is a Saudi-based firm specializing in providing modern agricultural services,solutions, and technologies. We excel in establishing AI and IoT-supported smart farms, supplying essential agricultural products and tools, and designing and executing landscaping projects. Additionally, we create and implement greenhouses and hydroponic systems Our experts at Rafed are dedicated to staying abreast, of the latest innovations in the agricultural sector aiming to form comprehensive partnerships with our clients by meeting their needs throughout their journey."
163,"Raffia Factory Co., Ltd.",4-250,Agro-Food Processing & Packaging,Agro-Food Packaging,Saudi Arabia,www.raffia.sa,http://www.raffia.sa,"Raffia Factory Co., Ltd.","The Kingdom of Saudi Arabia is one of the largest Petrochemicals-producing countries in the world. Naturally, conversion industries were built to produce products for end–users.Enhancing this fact and to go along with the Saudi Industrial Development, RAFFIA FACTORY was established in late 1996, by pure Saudi investment of 24,000,000 twenty-four million Saudi Riyals Capital.Commercial production was started in early 1997, concentrating on producing Woven Sacks out of Polypropylene yarn with an initial capacity of (60,000,000) sixty million sacks per annum. Due to the increase in demand for our products, both locally and abroad, and the trust given to us by our valuable clients, and to meet this demand, an expansion was made in 1999 raising the capacity to reach (90,000,000) ninety million sacks per annum, out of which two million heavy-duty JUMBO bags with capacity ranging from 0.5-1.5 tons.Additionally, the factory produces Leno bags, Baler Twine, Rope, Agri Twine, Film/Liner, Cable Filler yarn, Sleeping, and Floor Mats - produced from fibrillated PP yarn."
164,Raji Hussein S. Alamoudi Plastic Industries,4-295,Agro-Food Processing & Packaging,Agro-Food Packaging,Saudi Arabia,www.roshana.com.sa,http://www.roshana.com.sa,Raji Hussein S. Alamoudi Plastic Industries,
