raw_row_number,company_name_raw,stand_no,sector,products,country,website_text,website_url,company_column,details
1,"2MBio Co., Ltd.",1-186,Crop Farming,,South Korea,,,"2MBio Co., Ltd.",
2,"4D Bios Co., Ltd.",1-377,Agriculture Technologies,"Hydroponics, Smart Farming, Vertical Farming",China,www.4d-bios.com,http://www.4d-bios.com,"4D Bios Co., Ltd.","Founded in 2018, 4D Bios is a leading innovator in Agriculture 4.0, dedicated to revolutionizing vertical farming through intelligent, standardized, and scalable solutions. By deeply integrating core technologies such as LED grow lighting, vertical farming systems, smart environmental controls, plant nutrition, and crop cultivation expertise, 4D Bios is building the world’s most advanced fully automated vertical farms.At 4D Bios, quality and safety are paramount. Our fully digitalized quality control systems guarantee that every harvest is free from pesticides, heavy metals, and synthetic additives, ensuring farm-to-table safety across diverse applications, from vegetables and strawberries to medicinal herbs and seedlings. Our proprietary AI+IoT ecosystem automates the entire cultivation process—from seeding to harvesting—achieving significantly improving yield efficiency."
3,Abdul Rahman Obaid Nafil Al-Harbi Agricultural Est.,4-280,,,Saudi Arabia,,,Abdul Rahman Obaid Nafil Al-Harbi Agricultural Est.,
4,Abdullah Mohammed Al-Rasheed & Partners Co.,1-419,Crop Farming,Fertilizers & Pesticides,Saudi Arabia,www.al-rasheed.com.sa,http://www.al-rasheed.com.sa,Abdullah Mohammed Al-Rasheed & Partners Co.,
5,"AE Desarrollo & Crecimiento, S.L.U.",1-260,"Organic & Agro-Food, Agro-Food Processing & Packaging","Dairy Products, Agro-Food Production & Processing",Spain,aedesarrollo.com,http://aedesarrollo.com,"AE Desarrollo & Crecimiento, S.L.U.","Production and commercialization of alfalfa, wheat straw, grass, corn silage and livestock fiber pellets."
6,AFAQVET,1-420,,,Saudi Arabia,,,AFAQVET,
7,AGI EMEA SRL,4-470,Agro-Food Processing & Packaging,Refrigeration & Storage,Italy,www.aggrowth.com,http://www.aggrowth.com,AGI EMEA SRL,"AGI is one of the world’s leading manufacturer and solution provider of farm and commercial equipment. We understand that feeding the world requires a global network of infrastructure and technology to: store, blend, mix, convey, condition, process, and protect hundreds of millions of tons of agriculture inputs and crops. AGI equipment technology and services facilitate this global movement, from growing crops and moving them to market, to processing crops into feed for animals and food for people. Our complete catalogue includes silos, catwalks, ladders, platforms, as well as bucket elevators, chain conveyors, temperature sensing, sweeps, weighing, bagging dryers and more. From the first design, to manufacturing and installation, AGI delivers custom systems and solutions across a range of applications and industries, including small farms to industry grain traders, millers, feed mills and large port facilities. AGI has installations in over 100 countries with various climate conditions covering all 7 continents."
8,Agremax General Trading LLC,3-150,"Crop Farming, Poultry Livestock & Dairy Farming","Fertilizers & Pesticides, Animal Health & Technologies, Feeds & Additives",UAE,www.agremax.net,http://www.agremax.net/,Agremax General Trading LLC,"We are AGREMAX, an Emirates-Egyptian privately owned international Company founded in 2015, which supplies 1st class Egyptian Sugar Beet Pulp Pellets and Spanish Dehydrated Alfalfa.We are a certified member of GAFTA (Grain & Feed Trade Association) with ISO 9001, ISO 14001 & ISO 45001. AgreMax is also an official member of Agriculture Export Council, and we are the largest exporter of Egyptian Sugar Beet Pulp exporting more than 50% of Egypt SBPP (more than 350000 MT annually) worldwide to UK, Ireland, Japan, Korea, China, Middle East, Gulf and North Europe, supplying high quality products according to premium international standards.Our expert team handles the shipments professionally and smoothly to the destination country, with all the required documents according to the customer’s instructions. Thanks to our partners abroad for the trust and long-term business relation which is growing year after year."
9,Agrico International DMCC,3-170,"Organic & Agro-Food, Poultry Livestock & Dairy Farming","Dairy Products, Feeds & Additives",UAE,www.agricointl.com,http://www.agricointl.com/,Agrico International DMCC,"Headquartered in Dubai, AGRICO International is a leading home-grown agricultural commodity originator and trading house in the Middle East region.The company provides the finest livestock raw materials, food grains, and end-to-end supply chain management to a range of high-profile customers and government entities."
10,Agricool Group (Agritech for Trading Est.),1-467,,,Saudi Arabia,,,Agricool Group (Agritech for Trading Est.),
11,"Agricultural Machinery & Materials Co., Ltd. (AMMC)",5-228,"Crop Farming, Poultry Livestock & Dairy Farming, Agro-Food Processing & Packaging","Crop Protection, Fertilizers & Pesticides, Landscaping & Nurseries, Animal Health & Technologies, Feeds & Additives, Refrigeration & Storage",Saudi Arabia,www.ammc.com.sa,http://www.ammc.com.sa,"Agricultural Machinery & Materials Co., Ltd. (AMMC)","Pioneer Agricultural company with immersive activity since 1982 and specialized in providing agricultural inputs and the latest technology that support sustainability and innovation solutions.Products & Services: Crop Protection, Vet Services, Crop Nutrition, Seeds, Professional Pest Management, Irrigation, Landscaping, Nurseries Machinery & Tools"
12,Agricultural Technology Middle East Co.,4-394,,,Saudi Arabia,,,Agricultural Technology Middle East Co.,
13,Agrikal Tarim Ve San Minerallari Ltd. Şti (Fitsa),5-219,,,Turkiye,agrikal.com.tr,http://agrikal.com.tr/,Agrikal Tarim Ve San Minerallari Ltd. Şti (Fitsa),
14,Agrotech Tarim Ürün. San Ve Tic Ltd Şti,3-270,,,Turkiye,,,Agrotech Tarim Ürün. San Ve Tic Ltd Şti,
15,Agrovermi Middle East Organic Fertilizer Trading LLC,4-491,,,UAE,,,Agrovermi Middle East Organic Fertilizer Trading LLC,
16,Agtinium LLC,5-124,,,USA,,,Agtinium LLC,
17,Al Areen Company for Agri Fabric Production,4-390,,,Saudi Arabia,areenfabric.sa,http://areenfabric.sa/,Al Areen Company for Agri Fabric Production,
18,Al Dahra Khalijiah Company Limited,3-169,,,UAE,,,Al Dahra Khalijiah Company Limited,
19,Al Dayfe for Agricultural Investment Co.,4-469,"Crop Farming, Poultry Livestock & Dairy Farming, Organic & Agro-Food, Agro-Food Processing & Packaging, Aquaculture, Agriculture Technologies","Dairy Products, Frozen Foods, Dried & Canned Foods, Honey & Dates, Crop Protection, Farming Technologies, Fertilizers & Pesticides, Landscaping & Nurseries, Animal Health & Technologies, Livestock Technologies, Agro-Food Production & Processing, Refrigeration & Storage, Greenhouses Solutions",Saudi Arabia,www.aldayfeagri.com,http://www.aldayfeagri.com,Al Dayfe for Agricultural Investment Co.,"Al Dayfe For Agricultural Investment Company was established in 1984. It is a member of Al Dayfe Holding Group. Nowadays and after more than 40 years of growth and keeping up with economic and technical changes, Al Dayfe For Agricultural Investment Company is considered as a one of the largest major companies that specialized in providing agricultural products and all its related services like ( Pesticides - seeds - fertilizers - agricultural equipment and spare parts, And also the gardening equipment and small agricultural tools has been established recently).And that is through its branches which are spread in most regions of the Kingdom of Saudi Arabia (15 branches / services centers), and its strategic partnerships with the most important local and international suppliers in agricultural products and services field.Our company becomes the exclusive agent for many international products (European, Australian, Chinese and Indian, …) and one of the authorized distributors for the most trusted local agricultural products by the consumer (SABIC).With our high ambition and inspiration that never stops through kingdom vision 2030, we continue in developing our business and enrich our services to reach to the largest target of valuable customers, who we consider them as our success partners and our primary priority by providing the products and services in a modern local spirit and with international standards of contribute to achieving food security for our society and future generations."
20,Al Hadaf Level Company For Trading,5-329,,,Saudi Arabia,,,Al Hadaf Level Company For Trading,
21,Al Jammaz Agriculture Company,4-349,"Agriculture Technologies, Crop Farming","Hydroponics, Vertical Farming, Crop Protection, Farming Technologies, Fertilizers & Pesticides, Landscaping & Nurseries",Saudi Arabia,www.aljammazag.com,http://www.aljammazag.com,Al Jammaz Agriculture Company,"Al-Jammaz Agriculture Company is one of the leading companies in the field of agriculture in providing modern agricultural techniques and technology that contribute to the development of the market and help achieve sustainable food production.Pesticides The latest technology is available from leading international companies such as FMC, Cortiva, Bayer Kocid, Aceto, UPL, Linco.In seeds is represented by several American and European companies, Rijk Zwaan, Suba, Agro tip, GSN and Heinz. In the field of feed, it owns the best American and Australian alfalfa from Forage Genetics, Seeds Technology and Marketing, Pioneer Cortiva, S&W and Imperial Valley Seeds, as well as fodder corn from Westek Inc.Fertilizers The company markets soluble and liquid fertilizers for many international companies, Chan Fert, Evergrow, Tessenderlo, Merstim, Rosier and Albion.Al-Jammaz Hydrotek is one of the main distributors in water and landscaping solutions, through its distribution of Kessel, ITC VALTICINO, POZZA, Hunter, Rheem, DAB and Charlotte."
22,Al Kayan Fertilizer Modern Co.,5-330,Crop Farming,Fertilizers & Pesticides,Saudi Arabia,,,Al Kayan Fertilizer Modern Co.,
23,Al Khorayef Industries Co.,4-249,"Agriculture Technologies, Aquaculture","Smart Irrigation, Aquaculture Systems & Technologies",Saudi Arabia,www.alkhorayef.com,http://www.alkhorayef.com,Al Khorayef Industries Co.,"Al Khorayef Industries Company (AIC) is part of the Alkhorayef Group of Companies (AGC) which was founded in 1957. AIC is leading the industrial, agricultural & irrigation systems around the world. Operating in area of 91.000 M2, located in the 2nd industrial city, Riyadh. The division has a long and proud history in the agricultural sector.Today AIC is one of world’s big four manufacturers of large-scale irrigation systems having strong international presence in Europe, Russia, North America, South America, Australia, New Zealand, and Africa.AIC is globally helping food producers meet growing demand in a way that is both environmentally friendly and profitable.Over the years AIC has developed a full industrial in-house echo system that includes the fabrication and production of:• Irrigation Smart systems (center pivot and linear systems).• Pump solutions (deep well, horizontal, and canal pump solutions)• Steel & Polyethylene Lined Pipes• Electrical Generators Manufacturing (Power Generation & Control Panel Solutions)• Steel Engineering & Fabrication (skids, Canopies, mobile & modular units)• AIC LAB & Consulting Services• AIC Industrial Training Program"
24,Al Khumasia Company For Feed And Animals Products,1-230,"Poultry Livestock & Dairy Farming, Aquaculture","Animal Health & Technologies, Feeds & Additives, Aquaculture Nutrition",Saudi Arabia,khumasia.sa,http://khumasia.sa/,Al Khumasia Company For Feed And Animals Products,"Al-Khumasia Feed Company is a 100% Saudi company founded in 2002 and specializes in the field of animal production of various types. Al-Khamasiya is currently considered one of the most important and largest national companies working in the provision of feed, which produces different types of feed."
25,"Al Mahalliah Trading & Agriculture Co., Ltd.",1-410,"Crop Farming, Aquaculture","Crop Protection, Farming Technologies, Fertilizers & Pesticides, Landscaping & Nurseries, Aquaculture Materials, Aquaculture Nutrition, Aquaculture Systems & Technologies",Saudi Arabia,www.almahalliah.com,http://www.almahalliah.com,"Al Mahalliah Trading & Agriculture Co., Ltd.","AL-Mahalliah Trading & Agriculture Co., Ltd. Import, wholesale and distribution of full range of organic inputs (Bio-Insecticides, Bio-Fungicides, Bio-Fertilizers). Import, wholesale of field crops, fooder, vegetable seeds. Import, wholesale, distribution of chemical fertilizers, pesticides and fungicides, soil conditioning products. Import of composting machinery, food processing plants and agricultural machineries."
26,"Al Muneef for Trade, Industry, Agriculture and Contracting",1-340,Crop Farming,"Crop Protection, Farming Technologies, Fertilizers & Pesticides, Landscaping & Nurseries",Saudi Arabia,almuneefagri.com,http://almuneefagri.com,"Al Muneef for Trade, Industry, Agriculture and Contracting","Al Muneef Company is in the Saudi stock market, and it is a company in that has been built since 1984, we are growing in the Saudi kingdom, and we have 15 brunches fully with a smart agri engineering, we have around 130 agri products."
27,Al Ousaimi Group Co. for Trading,5-151,Crop Farming,"Fertilizers & Pesticides, Nurseries, Landscaping",Saudi Arabia,www.ousaimi.com.sa,http://www.ousaimi.com.sa/,Al Ousaimi Group Co. for Trading,
28,Al Rafiq Greenhouses Company,4-487,,,Jordan,,,Al Rafiq Greenhouses Company,
29,Al Rajhi and Al-Misfer Agricultural Co.,4-239,Crop Farming,"Crop Protection, Fertilizers & Pesticides",Saudi Arabia,www.alrajhiagriculturecompany.com,http://www.alrajhiagriculturecompany.com/,Al Rajhi and Al-Misfer Agricultural Co.,"Al-Rajhi and Al-Misfer Agricultural Company is one of the first agricultural companies in the Kingdom of Saudi Arabia, founded in 1984, the main administrative office is located in the capital, Riyadh, and it has 9 branches distributed over most of the main agricultural areas in the Kingdom of Saudi Arabia, which are located in the following regions: Wadi Al-Dawasir, Al-Kharj, Riyadh, Qassim, Sajir, Hail, Taberjal, Tabuk, and Dammam.Al-Rajhi and Al-Misfer Agricultural Company have an agency for SABIC fertilizers, which includes many materials, the most important of them are Urea fertilizer and DAP fertilizer.Al-Rajhi and Al-Misfer Agricultural Company is committed to providing agricultural services at a technical and innovative level in all local and international markets, and the company provides all agricultural services to farmers of wheat, barley, fodder crop and vegetables, through different types of fertilizers, seeds, and pesticides"
30,Al Rajhia Dates Company for Agricultural Production (RAPCO),1-329,Organic & Agro-Food,Agro-Food Production & Processing,Saudi Arabia,erp.awqafrajhi.sa,http://erp.awqafrajhi.sa/,Al Rajhia Dates Company for Agricultural Production (RAPCO),
31,Al Rawda Factory,4-150,"Agriculture Technologies, Crop Farming","Greenhouses Solutions, Crop Protection, Landscaping & Nurseries",Saudi Arabia,www.rgh.com.sa,http://www.rgh.com.sa/,Al Rawda Factory,Is the first Saudi factory specialized in the green house industry to be established.
32,Al Raya Specialities Industrial Company,5-104,,,Saudi Arabia,,,Al Raya Specialities Industrial Company,
33,Al Taleb Group,1-330,Crop Farming,"Fertilizers & Pesticides, Landscaping & Nurseries",Saudi Arabia,www.altalebgroup.com,http://www.altalebgroup.com,Al Taleb Group,"As a trading company of the leading companies working in agricultural chemicals, seeds, agricultural machinery, fertilizers and others in the Kingdom of Saudi Arabia since 1985, the company has a team of highly qualified and experienced employees working according to a professional system with the aim of providing excellent services to everyone at the international and local levels, and even At this time, the company has succeeded in maintaining long-term business relationships with many famous companies around the world, such as Spain, Belgium, America, England, China, India, and various countries in the Middle East.The company started with one branch for agricultural products to reach today 14 branches distributed over the regions of the Kingdom to provide the company's products and services to all our customers in the Kingdom."
34,Al Tanseeq Co.,5-320,Agriculture Technologies,Greenhouses Solutions,Saudi Arabia,,,Al Tanseeq Co.,
35,Al Wasail Industrial Company,4-210,Agriculture Technologies,AI & Smart Applications,Saudi Arabia,alwasail.com,http://alwasail.com,Al Wasail Industrial Company,Al Wasail Industrial Company’s vision is to become the local market leader in High Density Polyethylene (HDPE) and fitting producer serving contractors and farmers with complete quality solution.
36,Al Watania Agriculture Company,1-360,Agro-Food Processing & Packaging,Agro-Food Production & Processing,Saudi Arabia,www.watania-agri.com,http://www.watania-agri.com,Al Watania Agriculture Company,
37,Al Yaseen Agriculture Co.,4-439,"Aquaculture, Official Agency","Aquaculture Systems & Technologies, Trade Association, Trade Promotion Council",Saudi Arabia,www.alyaseenagri.com,http://www.alyaseenagri.com,Al Yaseen Agriculture Co.,"ALYASEEN AGRI is a leading company in many agricultural fields in Saudi Arabia, its reputation isbuilt with over 45 years of experience in the Saudi Agricultural market. Since its establishment, itadopted a vision of (Achieving Leadership and Excellence in the Saudi Agriculture market).ALYASEEN AGRI always searches international markets for new agricultural technologies that meetthe needs of its customers and economically viable, which adds value to the products of its customersfrom individuals to large agricultural companies in Saudi. ALYASEEN AGRI provides its service tovegetable, fruit, winter forage, gardening, and nursery growers through its 12 branches covering all theKingdom’s agricultural regions. Each branch is equipped with excellent technical staff to support salesof its quality solutions and reasonable prices..ALYASEEN AGRI uses its dedicated Trail Station to study and assure that new products andtechnologies are suitable for Saudi environment and local agriculture practices before introducing themto the market.ALYASEEN AGRI signed exclusivity contracts with major suppliers from USA, Europe, Asia, andAfrica in various fields such as seeds, agrochemicals, fertilizers, and a range of other agricultural inputs.ALYASEEN AGRI continues to fulfill its vision by always looking for new agricultural technologies.In recent years, ALYASEEN AGRI created marketing divisions to extend its services to the agriculturalsector to include Integrated Pest Management (IPM), Gardening / Public Health, Machinery, and AgriTechnology and division of Netra."
38,Alliance Food Security Holding LLC,1-486,,,UAE,,,Alliance Food Security Holding LLC,
39,Almarai,1-110,Organic & Agro-Food,"Dairy Products, Frozen Foods, Dried & Canned Foods, Honey & Dates, Meat Products, Poultry & Fish Products, Spices & Oil",Saudi Arabia,www.almarai.com,http://www.almarai.com,Almarai,"Founded in 1977, Almarai Company is the world’s largest vertically integrated dairy company and the largest food and beverage manufacturing and distribution company in MENA. Headquartered in the Kingdom of Saudi Arabia, Almarai Company is ranked as the number one FMCG Brand in the MENA region and the market leader in all its categories across the GCC.With more than 48 years of sustainable growth, Almarai Company continues to provide nutritious and healthy products to consumers of all ages with its growth stemming from its bedrock principle, “Quality you can trust”. Almarai has expanded its product range to include, in addition to dairy products, juices and beverages, baked goods, poultry, infant formula, dates, fish and seafood, and bottled water, under more than 20 brands such as Almarai, L’usine, 7DAYS, ALYOUM, Nuralac, Farm’s Select, Ice Leaf, Almira, Seama, Oska, IVAL, Almara Pro, Premier Chef, Bakemart and others. In 2024, Almarai reported net income of SAR 2.31 billion on sales of SAR 20.98 billion."
40,Altintar Tarim A.Ş,3-189,,,Turkiye,altintar.com,http://altintar.com/,Altintar Tarim A.Ş,
41,"Alvan Blanch Development Co., Ltd.",1-550,Crop Farming,"Crop Protection, Farming Technologies",United Kingdom,www.alvanblanchgroup.com,http://www.alvanblanchgroup.com,"Alvan Blanch Development Co., Ltd.","Alvan Blanch is a family-owned business, established over 70 years ago and manufacturing equipment at our highly automated factory in the United Kingdom. We supply equipment to many parts of the world; we are honored to have been supporting Middle East Agriculture for more than 40 years and have a large customer base in the region. We can provide specialized feed milling plants including steam flaking for ruminant feeds, seed cleaning, automated bag filling lines, grain silos and the associated inventory management systems. We provide driers for a large range of products; all the plants include automated control systems. We are specialists at remodeling existing plants; we are proud of our flexibility and processing knowledge to adapt to customers’ unique requirements. After-sales technical support is provided with service engineers from our office and company in Dubai."
42,Andritz Feed & Biofuel S/S,1-270,,,Denmark,,,Andritz Feed & Biofuel S/S,
43,"Angel Yeast Co., Ltd.",1-482,"Poultry Livestock & Dairy Farming, Aquaculture","Animal Health & Technologies, Feeds & Additives, Livestock Technologies, Aquaculture Nutrition",China,en.angelyeast.com,http://en.angelyeast.com,"Angel Yeast Co., Ltd.","Angel is a global yeast and biotech company that develops natural ingredient solutions for the food & beverage, nutritional, and biotechnology industries. Angel Yeast was founded in 1986. Angel Yeast Co., Ltd was listed on the Shanghai Stock Exchange in 2000. “Developing yeast biotechnology, innovate for a healthy life” is our mission. We study how biotechnology can change our lifestyles for the better and help us live in harmony with nature. As a yeast supplier with a global presence, Angel has 33 Production Facilities across the globe, with products and services supplied to more than 170 countries and regions."
44,Arab World Agribusiness Magazine,1-194,Official Agency,Media Partner,Bahrain,www.fanarpublishing.net,http://www.fanarpublishing.net,Arab World Agribusiness Magazine,"Arab World Agribusiness (AWA) is the only farm journal produced in an Arab Country, published by Fanar Publishing Co. WLL of Bahrain since 1985. For 41 years, AWA has emerged as the Arab World's highest circulation magazine for agriculture. With over 18,715 copies distributed largely among Arab farmers, policymakers and researchers. AWA has become the most reliable source of information. Besides the printed copies distribution, we send electronic copy by email with direct link to all concerned people in agriculture and food field and magazine subscribers (20,000) in every issue free of charge. Moreover, we launch each issue of the magazine on our website as soon as it is published.Arab Agriculture: AWA has a prestigious annual yearbook. ""Arab Agriculture"" which is an encyclopedia of information on Arab Agriculture and suppliers of farm technology worldwide, arranged product-wise and country-wise. Arab Agriculture gives indispensable information vitally needed for developing trade contacts presented in an easy-to-read style."
45,ARASCO (Arabian Agricultural Services Co.),3-230,,,Saudi Arabia,,,ARASCO (Arabian Agricultural Services Co.),
46,Areen Najd Trading Est.,4-296,,,Saudi Arabia,,,Areen Najd Trading Est.,
47,Artat Enterprise,2-240,"Organic & Agro-Food, Agriculture Technologies, Crop Farming, Poultry Livestock & Dairy Farming, Aquaculture","Dairy Products, Frozen Foods, Dried & Canned Foods, Honey & Dates, Meat Products, Poultry & Fish Products, Spices & Oil, Greenhouses Solutions, Hydroponics, Smart Farming, Crop Protection, Farming Technologies, Fertilizers & Pesticides, Animal Health & Technologies, Feeds & Additives, Livestock Technologies, Poultry Systems & Technologies, Aquaculture Materials, Aquaculture Nutrition",Saudi Arabia,www.artat.com.sa,http://www.artat.com.sa,Artat Enterprise,"ARTAT Enterprise, founded in the Kingdom of Saudi Arabia in 2003, is a fast-growing company that specialized initially in Animal Health and Nutrition Solutions mainly for Livestock and Poultry. We have managed successfully to establish a profound network of trusted customers who have invited us to extend our services to cover various solutions from FARM to FORK. We have allied with multiple departments that provide integrated solutions: Animal Health & Nutrition, Farm Biosecurity measures & Equipment, and Food Safety Diagnostics. Our rich portfolio allowed us to provide thousands of products and customized solutions to livestock industries & organizations worldwide where we were awarded to be the sole PARTNER of many international manufacturers of feed, feed additives, vaccines, diagnostics & many others. ARTAT is proud to have some of the best animal nutritionists and consultants who have a wealth of experience extending to 60+ years and are passionate about their knowledge and experience with all customers. They also provide customized solutions that customers need and ensure more production. Our vision for ARTAT is to be referred to as the most favorable company for the supply of Animal Health and Food Safety Solutions to the Livestock & Food Production Industries with a focus on QUALITY, SERVICE & CUSTOMER Involvement."
48,Artigianfer Srl,4-492,,,Italy,,,,
